{
  "schemaVersion": "0.1",
  "kind": "p4.1-independent-protocol-review",
  "status": "approved",
  "reviewedCommit": "033738e3c265d5b615630b6f9bee78c7fc897806",
  "messageCorpusDigest": "sha256:1e783a3be9098efc776ce8771e1ce9d44bf5c89eff9913e472fc686c5fa7b241",
  "sessionCorpusDigest": "sha256:9be355e4276a9d0249927693144f084b0fb52316cb92f3ba5f08440762e72692",
  "reviewer": {
    "id": "Pitchayut586",
    "independent": true
  },
  "scopes": {
    "protocol": "approved",
    "security": "approved",
    "interoperability": "approved",
    "package": "approved"
  },
  "findings": [],
  "unresolvedCriticalHigh": 0,
  "disposition": "no_unresolved_critical_high"
}
